{
  "contract_version": "course-1",
  "module": "catalog",
  "action": "probe",
  "version": 1,
  "http_method": "POST",
  "target_schema": "app",
  "target_function": "catalog_probe",
  "request_schema": {
    "type": "object"
  },
  "response_schema": {
    "type": "object"
  },
  "outcomes": ["PROBED"],
  "required_policy": ["catalog:probe"],
  "idempotency_mode": "none",
  "idempotency_scope": "none",
  "timeout_ms": 1000,
  "enabled": false,
  "is_default": false
}
